{"id":"source.telegram","current_identifier":"ohmymeme.integrations.imports.telegram","flow":["locate_tdata","derive_key","decrypt_cache","convert_webm","deduplicate","import"],"state":["idle","scanning","loading_key","decrypting","converting","deduping","importing","done","error","cancelled"],"paths":["%APPDATA%/Telegram Desktop/tdata","<tdata>/user_data/cache","<tdata>/user_data/media_cache","system temporary directory"],"protocols":["TDF$ AES-IGE","TDEF AES-CTR","ffmpeg"],"abi_aliases":["pick_tg_tdata","start_tg_import","get_tg_import_progress","cancel_tg_import"],"package_root":"ohmymeme_plugin_telegram","license_provenance":"GPL-3.0 project license","allowed_variance":["ids","timestamps","temporary paths","thread ordering"]}
