{"id":"sync.webdav","current_identifier":"ohmymeme.services.sync.backends._WebDAVBackend","flow":["connect","ensure_remote_dir","upload_or_download","merge_manifest","finalize"],"state":["idle","connecting","uploading","downloading","deleting","done","error","cancelled"],"paths":["{root}/memes/","{root}/meme-index.json","webdav_path"],"protocols":["WebDAV","PROPFIND","PUT","GET","DELETE","Basic Auth"],"abi_aliases":["sync_push","sync_pull","sync_test","get_sync_progress"],"package_root":"ohmymeme_plugin_sync_webdav","license_provenance":"GPL-3.0 project license","allowed_variance":["ids","timestamps","temporary paths","thread ordering"]}
