{"id":"source.douyin","current_identifier":"ohmymeme.integrations.imports.douyin","flow":["build_session","check_login","list_stickers","sign_requests","download","import"],"state":["idle","running","done","error","cancelled"],"paths":["system temporary directory","%APPDATA%/OhMyMeme"],"protocols":["HTTPS","ABogus","Chrome124 TLS fingerprint"],"abi_aliases":["start_douyin_import","get_douyin_import_progress","cancel_douyin_import"],"package_root":"ohmymeme_plugin_douyin","license_provenance":"GPL-3.0:ABogus source provenance; project GPL-3.0","allowed_variance":["ids","timestamps","temporary paths","thread ordering"]}
