{"id":"sync.s3","current_identifier":"ohmymeme.services.sync.backends._S3Backend","flow":["create_client","upload_or_download","merge_manifest","finalize"],"state":["idle","connecting","uploading","downloading","deleting","done","error","cancelled"],"paths":["{root}/memes/","{root}/meme-index.json","s3_path"],"protocols":["S3 API","signature v2/v4 compatibility","virtual/path addressing"],"abi_aliases":["sync_push","sync_pull","sync_test","get_sync_progress"],"package_root":"ohmymeme_plugin_sync_s3","license_provenance":"GPL-3.0 project license","allowed_variance":["ids","timestamps","temporary paths","thread ordering"]}
