{"id":"sync.r2","current_identifier":"ohmymeme.services.sync.backends._R2Backend","flow":["derive_endpoint","create_client","upload_or_download","merge_manifest","finalize"],"state":["idle","connecting","uploading","downloading","deleting","done","error","cancelled"],"paths":["{root}/memes/","{root}/meme-index.json","r2_path"],"protocols":["Cloudflare R2 S3 API","signature v4","virtual/path addressing"],"abi_aliases":["sync_push","sync_pull","sync_test","get_sync_progress"],"package_root":"ohmymeme_plugin_sync_r2","license_provenance":"GPL-3.0 project license","allowed_variance":["ids","timestamps","temporary paths","thread ordering"]}
