{"id":"transport.lan","current_identifier":"ohmymeme.services.lan.protocol","flow":["udp_discovery","tcp_handshake","device_approval","encrypted_commands","close"],"state":["stopped","starting","listening","handshaking","awaiting_confirmation","connected","stopping","done","error"],"paths":["0.0.0.0:<port>","%APPDATA%/OhMyMeme/config.json","%LOCALAPPDATA%/OhMyMeme/cache"],"protocols":["UDP discovery","TCP length-prefixed JSON","HMAC-SHA256","PBKDF2-SHA256","AES-GCM"],"abi_aliases":["lan_start","lan_stop","lan_get_status","lan_confirm_device","lan_set_allow_secret_config"],"package_root":"ohmymeme_plugin_lan","license_provenance":"GPL-3.0 project license","allowed_variance":["ids","timestamps","temporary paths","thread ordering"]}
