{"id":"sync.ftp","current_identifier":"ohmymeme.services.sync.backends._FtpBackend","flow":["connect","ensure_remote_dir","push_or_pull","finalize_manifest"],"state":["idle","connecting","uploading","downloading","deleting","done","error","cancelled"],"paths":["{root}/memes/","{root}/meme-index.json","ftp_path"],"protocols":["FTP","FTPS","UTF-8","PROT P"],"abi_aliases":["sync_push","sync_pull","sync_test","get_sync_progress"],"package_root":"ohmymeme_plugin_sync_ftp","license_provenance":"GPL-3.0 project license","allowed_variance":["ids","timestamps","temporary paths","thread ordering"]}
