{"id":"source.qqnt","current_identifier":"ohmymeme.integrations.imports.qqnt","flow":["inspect_environment","select_account","copy_images","normalize_extensions"],"state":["idle","checking","copying","done","error","cancelled"],"paths":["UserDataInfo.ini","<UserDataSavePath>/<QQ号>/nt_qq/nt_data/Emoji/personal_emoji/Ori","%APPDATA%/OhMyMeme/cache"],"protocols":["filesystem","magic-bytes"],"abi_aliases":["qqnt_check_env","qqnt_start","qqnt_get_progress","qqnt_cancel"],"package_root":"ohmymeme_plugin_qqnt","license_provenance":"GPL-3.0:QQFavoriteExtract adaptation","allowed_variance":["ids","timestamps","temporary paths","thread ordering"]}
