{"id":"source.wechat","current_identifier":"ohmymeme.integrations.imports.wechat","flow":["inspect_environment","select_account","verify_helper","extract_key","decrypt_sqlite_wal","download_cdn","import"],"state":["idle","scanning","querying","extracting_key","decrypting_db","downloading","importing","done","error","cancelled"],"paths":["<root>/wxid_*/db_storage/emoticon/emoticon.db","<root>/wxid_*/db_storage/favorite/favorite.db","%LOCALAPPDATA%/OhMyMeme/.wechat"],"protocols":["supervised helper subprocess","AES-256-CBC","SQLite/WAL","allowlisted HTTPS CDN"],"abi_aliases":["inspect_wechat_environment","start_wechat_import","get_wechat_import_progress","cancel_wechat_import"],"package_root":"ohmymeme_plugin_wechat","license_provenance":"GPL-3.0 project license; helper source provenance","allowed_variance":["ids","timestamps","temporary paths","thread ordering"]}
